{
  "version": "0.1",
  "name": "Example Name",
  "handle": "example",
  "location": "City, Country",
  "bio": "Short example bio describing what this person does.",
  "avatar": "https://api.dicebear.com/7.x/avataaars/svg?seed=example",
  "banner": "https://images.unsplash.com/photo-1519681393784-d120267933ba?w=1200&h=400&fit=crop",
  "links": {
    "website": "https://example.com",
    "github": "example",
    "soulink": "example"
  },
  "buttons": [
    {
      "text": "Primary Call To Action",
      "url": "https://cal.com/example",
      "style": "primary",
      "icon": "ðŸ“…"
    },
    {
      "text": "Secondary Action",
      "url": "https://buymeacoffee.com/example",
      "style": "secondary",
      "icon": "â˜•"
    }
  ],
  "pages": [
    { "slug": "about", "title": "About", "file": "about.md", "visible": true }
  ]
}
